{
  "$schema": "../../schemas/manual-evidence.schema.json",
  "schemaVersion": "0.3.0",
  "evidenceKind": "template",
  "recordedAt": "1970-01-01T00:00:00.000Z",
  "modVersion": "fill-after-real-test",
  "notes": "Copy this file to an evidence work directory, replace template values after a real game test, then set evidenceKind to real-manual-test.",
  "windowsSmoke": {
    "status": "not-run",
    "civ6Build": "fill-after-real-test",
    "ruleset": "fill-after-real-test",
    "modEnabledInAdditionalContent": false,
    "releaseManifestValidated": false,
    "copilotButtonVisible": false,
    "localizedTextOk": false,
    "syncCurrentTurnExported": false,
    "selectiveSyncExported": false,
    "luaLogLoaded": false,
    "controlsAvailable": false,
    "gameApiAvailable": false,
    "playersApiAvailable": false,
    "mapApiAvailable": false,
    "base64SelfTest": false,
    "hasUnitsInPlot": false,
    "hasPlayerResources": false,
    "hasPlayerProgression": false,
    "hasGovernmentPolicies": false,
    "bridgeLatestJson": false,
    "preflightPassed": false,
    "validatePassed": false,
    "summarizePassed": false,
    "renderMapPassed": false,
    "doctorPassed": false,
    "visibleDataBoundaryOk": false,
    "noGameplayMutationObserved": false,
    "notes": "Record structured pass/fail conclusions and relevant version/build metadata."
  },
  "multiplayerFairness": {
    "status": "not-run",
    "humanPlayers": 2,
    "ruleset": "fill-after-real-test",
    "bothEnabledMod": false,
    "separateSnapshotDirs": false,
    "noDesyncObserved": false,
    "copilotUsesLocalVisibilityNotice": false,
    "playerA": {
      "localPlayerVerified": false,
      "ownCitiesOnly": false,
      "ownUnitsOnlyExceptVisibleForeign": false,
      "visibleForeignUnitsAreVisibleNow": false,
      "noHiddenMap": false,
      "noInvisibleForeignUnits": false,
      "noUnmetPlayers": false,
      "noOtherPlayerTechCivicsPolicies": false,
      "preflightPassed": false,
      "validatePassed": false,
      "summarizePassed": false,
      "renderMapVisibleOnly": false
    },
    "playerB": {
      "localPlayerVerified": false,
      "ownCitiesOnly": false,
      "ownUnitsOnlyExceptVisibleForeign": false,
      "visibleForeignUnitsAreVisibleNow": false,
      "noHiddenMap": false,
      "noInvisibleForeignUnits": false,
      "noUnmetPlayers": false,
      "noOtherPlayerTechCivicsPolicies": false,
      "preflightPassed": false,
      "validatePassed": false,
      "summarizePassed": false,
      "renderMapVisibleOnly": false
    },
    "notes": "Record pass/fail conclusions from both players after completing the cross-check."
  },
  "macCodexCopilot": {
    "status": "not-run",
    "skillInstalledValidated": false,
    "handoffGenerated": false,
    "codexPromptReadFirst": false,
    "copilotHandoffRead": false,
    "snapshotValidatedOnCopilotMachine": false,
    "localVisibilityNoticeShown": false,
    "syncBlockerHonored": false,
    "noBlindAnalysisWhenSyncRequired": false,
    "handoffScopeHonored": false,
    "notes": "Record pass/fail conclusions for the handoff workflow and sync-blocker behavior."
  }
}
